{"cveId": "CVE-2019-18904", "cwe": ["CWE-400", "CWE-400", "CWE-400", "CWE-400"], "cvss": [{"baseScore": "6.5", "version": "3.1", "Attack Vector": "None", "Attack Complexity": "Low", "Privileges Required": "Low", "User Interaction": "None", "Scope": "Unchaged", "Confidentiality Impact": "None", "Integrity Impact": "None", "Availability Impact": "High"}], "references": ["https://bugzilla.suse.com/show_bug.cgi?id=1160922"], "description": ["A Uncontrolled Resource Consumption vulnerability in rmt of SUSE Linux Enterprise High Performance Computing 15-ESPOS, SUSE Linux Enterprise High Performance Computing 15-LTSS, SUSE Linux Enterprise Module for Public Cloud 15-SP1, SUSE Linux Enterprise Module for Server Applications 15, SUSE Linux Enterprise Module for Server Applications 15-SP1, SUSE Linux Enterprise Server 15-LTSS, SUSE Linux Enterprise Server for SAP 15; openSUSE Leap 15.1 allows remote attackers to cause DoS against rmt by requesting migrations. This issue affects: SUSE Linux Enterprise High Performance Computing 15-ESPOS rmt-server versions prior to 2.5.2-3.26.1. SUSE Linux Enterprise High Performance Computing 15-LTSS rmt-server versions prior to 2.5.2-3.26.1. SUSE Linux Enterprise Module for Public Cloud 15-SP1 rmt-server versions prior to 2.5.2-3.9.1. SUSE Linux Enterprise Module for Server Applications 15 rmt-server versions prior to 2.5.2-3.26.1. SUSE Linux Enterprise Module for Server Applications 15-SP1 rmt-server versions prior to 2.5.2-3.9.1. SUSE Linux Enterprise Server 15-LTSS rmt-server versions prior to 2.5.2-3.26.1. SUSE Linux Enterprise Server for SAP 15 rmt-server versions prior to 2.5.2-3.26.1. openSUSE Leap 15.1 rmt-server versions prior to 2.5.2-lp151.2.9.1."], "published": "2020-04-03T07:15:11.507", "state": "PUBLIC", "vendorName": ["SUSE", "openSUSE"], "productName": ["SUSE Linux Enterprise High Performance Computing 15-ESPOS", "SUSE Linux Enterprise High Performance Computing 15-LTSS", "SUSE Linux Enterprise Module for Public Cloud 15-SP1", "SUSE Linux Enterprise Module for Server Applications 15", "SUSE Linux Enterprise Module for Server Applications 15-SP1", "SUSE Linux Enterprise Server 15-LTSS", "SUSE Linux Enterprise Server for SAP 15", "openSUSE Leap 15.1"], "github": {"advisories": [], "commits": [], "pocAdvisorie": null, "repo": null, "info": {}}, "pocList": []}