{"cveId": "CVE-2019-3695", "cwe": ["CWE-94", "CWE-94", "CWE-94", "CWE-94"], "cvss": [{"baseScore": "8.4", "version": "3.1", "Attack Vector": "Low", "Attack Complexity": "Low", "Privileges Required": "None", "User Interaction": "None", "Scope": "Unchaged", "Confidentiality Impact": "High", "Integrity Impact": "High", "Availability Impact": "High"}], "references": ["https://bugzilla.suse.com/show_bug.cgi?id=1152763"], "description": ["A Improper Control of Generation of Code vulnerability in the packaging of pcp of SUSE Linux Enterprise High Performance Computing 15-ESPOS, SUSE Linux Enterprise High Performance Computing 15-LTSS, SUSE Linux Enterprise Module for Development Tools 15, SUSE Linux Enterprise Module for Development Tools 15-SP1, SUSE Linux Enterprise Module for Open Buildservice Development Tools 15, SUSE Linux Enterprise Server 15-LTSS, SUSE Linux Enterprise Server for SAP 15, SUSE Linux Enterprise Software Development Kit 12-SP4, SUSE Linux Enterprise Software Development Kit 12-SP5; openSUSE Leap 15.1 allows the user pcp to run code as root by placing it into /var/log/pcp/configs.sh This issue affects: SUSE Linux Enterprise High Performance Computing 15-ESPOS pcp versions prior to 3.11.9-5.8.1. SUSE Linux Enterprise High Performance Computing 15-LTSS pcp versions prior to 3.11.9-5.8.1. SUSE Linux Enterprise Module for Development Tools 15 pcp versions prior to 3.11.9-5.8.1. SUSE Linux Enterprise Module for Development Tools 15-SP1 pcp versions prior to 4.3.1-3.5.3. SUSE Linux Enterprise Module for Open Buildservice Development Tools 15 pcp versions prior to 3.11.9-5.8.1. SUSE Linux Enterprise Server 15-LTSS pcp versions prior to 3.11.9-5.8.1. SUSE Linux Enterprise Server for SAP 15 pcp versions prior to 3.11.9-5.8.1. SUSE Linux Enterprise Software Development Kit 12-SP4 pcp versions prior to 3.11.9-6.14.1. SUSE Linux Enterprise Software Development Kit 12-SP5 pcp versions prior to 3.11.9-6.14.1. openSUSE Leap 15.1 pcp versions prior to 4.3.1-lp151.2.3.1."], "published": "2020-03-03T11:15:11.440", "state": "PUBLIC", "vendorName": ["SUSE", "openSUSE"], "productName": ["SUSE Linux Enterprise High Performance Computing 15-ESPOS", "SUSE Linux Enterprise High Performance Computing 15-LTSS", "SUSE Linux Enterprise Module for Development Tools 15", "SUSE Linux Enterprise Module for Development Tools 15-SP1", "SUSE Linux Enterprise Module for Open Buildservice Development Tools 15", "SUSE Linux Enterprise Server 15-LTSS", "SUSE Linux Enterprise Server for SAP 15", "SUSE Linux Enterprise Software Development Kit 12-SP4", "SUSE Linux Enterprise Software Development Kit 12-SP5", "openSUSE Leap 15.1"], "github": {"advisories": [], "commits": [], "pocAdvisorie": null, "repo": null, "info": {}}, "pocList": []}